{
  "$schema": "./catalog.schema.json",
  "name": "plugin4ai",
  "description": "Personal Claude Code plugin catalog — productivity skills",
  "owner": {
    "name": "rmompo",
    "email": "rmompo@gmail.com"
  },
  "plugins": [
    {
      "name": "p4-core",
      "description": "Core productivity plugin: behavioral directives (P4D), intelligent model routing via subagents, and Conventional Commits enforcement.",
      "category": "productivity",
      "status": "stable",
      "version": "1.2.30",
      "spec": "specs/p4-core.md",
      "path": "plugins/p4-core",
      "changelog": [
        {
          "version": "1.2.30",
          "changes": "model-route: fix: delegate via Agent tool, not Skill tool"
        },
        {
          "version": "1.2.29",
          "changes": "skill-list: remove enabled column, use 🟢/🔴 emoji indicators on plugin and skill cells"
        },
        {
          "version": "1.2.18",
          "changes": "git-sanitize: new session-start skill — enforces .gitattributes eol=lf and detects/fixes CRLF-contaminated tracked files"
        },
        {
          "version": "1.2.17",
          "changes": "sanitize: update argument-hint to [path]"
        },
        {
          "version": "1.2.16",
          "changes": "sanitize: new skill (moved from p4-plugin) — scans all sensitive-capable files in repo"
        },
        {
          "version": "1.2.15",
          "changes": "setup: add plugin dep check; skill-list: rename column to ready, check all dep types"
        },
        {
          "version": "1.2.13",
          "changes": "setup: read dependencies[] instead of requires[]"
        },
        {
          "version": "1.2.12",
          "changes": "skill-list: fix skill version source to catalog.json"
        },
        {
          "version": "1.2.11",
          "changes": "skill-list: add dedicated v column for skill version"
        },
        {
          "version": "1.2.10",
          "changes": "skill-list: add plugin/skill version display, collapse repeated plugin column"
        },
        {
          "version": "1.2.9",
          "changes": "Add setup skill to verify git and other tool dependencies"
        },
        {
          "version": "1.2.8",
          "changes": "git-commit: declare git as skill-level requires; skill-list: resolve tools from skill.requires when present"
        },
        {
          "version": "1.2.7",
          "changes": "skill-list: setup skills always show empty tools column"
        },
        {
          "version": "1.2.6",
          "changes": "skill-list: add tools column showing external dependency status"
        },
        {
          "version": "1.2.5",
          "changes": "skill-list: use Markdown table format in output"
        },
        {
          "version": "1.2.4",
          "changes": "Add skill-list skill"
        },
        {
          "version": "1.2.3",
          "changes": "Skill versions normalized to Z system (integers)"
        },
        {
          "version": "1.2.0",
          "changes": "Skill renames: commit→git-commit, model-routing→model-route, behaviour→model-behaviour"
        },
        {
          "version": "1.1.0",
          "changes": "Add model-behaviour skill (P4D directives)"
        },
        {
          "version": "1.0.0",
          "changes": "Initial release with git-commit and model-route skills"
        }
      ],
      "skills": [
        {
          "name": "git-commit",
          "version": 1,
          "changelog": [
            {
              "version": 1,
              "changes": "Initial release — extracted from p4-core inline instructions"
            }
          ],
          "dependencies": [
            {
              "type": "tool",
              "name": "git",
              "version": "*"
            }
          ]
        },
        {
          "name": "model-behaviour",
          "version": 2,
          "changelog": [
            {
              "version": 2,
              "changes": "Renamed from behaviour to model-behaviour"
            },
            {
              "version": 1,
              "changes": "Initial release — P4D directives extracted from .project/rules.md"
            }
          ]
        },
        {
          "name": "model-route",
          "version": 30,
          "changelog": [
            {
              "version": 30,
              "changes": "fix: delegate via Agent tool, not Skill tool"
            },
            {
              "version": 3,
              "changes": "Version alignment to Z system"
            },
            {
              "version": 2,
              "changes": "Stabilized model routing logic"
            },
            {
              "version": 1,
              "changes": "Initial release"
            }
          ]
        },
        {
          "name": "skill-list",
          "version": 22,
          "changelog": [
            {
              "version": 22,
              "changes": "plugin version line format changed from v1.2.3 to (v1.2.3) with parentheses"
            },
            {
              "version": 21,
              "changes": "partial skill separators (plugin column continues with │); plugin col always 2 physical lines; physical line counter includes separators and wrap lines; step 4 fully restructured"
            },
            {
              "version": 20,
              "changes": "description column wraps at 60 chars instead of truncating with ellipsis; row height expands for multi-line descriptions"
            },
            {
              "version": 19,
              "changes": "remove description truncation — full first sentence, no ellipsis; description column width is dynamic"
            },
            {
              "version": 18,
              "changes": "plugin cell split into 2 rows (name row + version row); headers center-aligned; data left-aligned; step 4 fully rewritten with numbered subsections and explicit example"
            },
            {
              "version": 17,
              "changes": "replace pipe Markdown table with Unicode box-drawing character table; dynamic column widths; plugin-group separators"
            },
            {
              "version": 16,
              "changes": "remove enabled column; use 🟢/🔴 emoji prefix on plugin and skill cells as enabled indicator"
            },
            {
              "version": 15,
              "changes": "rename tools column to ready; check both tool and plugin deps; update example table"
            },
            {
              "version": 12,
              "changes": "Read skill version from catalog.json (source of truth) instead of SKILL.md frontmatter"
            },
            {
              "version": 11,
              "changes": "Separate skill version into dedicated v column; plugin version stays concatenated"
            },
            {
              "version": 10,
              "changes": "Show plugin version in first row only; show skill version next to skill name"
            },
            {
              "version": 8,
              "changes": "support skill-level requires in tools column — skill.requires takes precedence over plugin.requires; git-commit now shows git status"
            },
            {
              "version": 7,
              "changes": "exclude setup skills from tools column — setup IS the tool checker, showing status there would be circular"
            },
            {
              "version": 6,
              "changes": "add tools column: ✅/❌ based on plugin requires availability via which; empty if no requires"
            },
            {
              "version": 5,
              "changes": "Use Markdown table format in output"
            },
            {
              "version": 4,
              "changes": "Initial release"
            }
          ]
        },
        {
          "name": "setup",
          "version": 14,
          "changelog": [
            {
              "version": 14,
              "changes": "add plugin dependency check to unified type table; update description"
            },
            {
              "version": 13,
              "changes": "Read dependencies[] filtered by type=tool instead of requires[]"
            },
            {
              "version": 9,
              "changes": "Initial release"
            }
          ]
        },
        {
          "name": "git-sanitize",
          "version": 1,
          "changelog": [
            {
              "version": 1,
              "changes": "Initial release — session-start skill: creates .gitattributes with eol=lf, detects and normalizes CRLF-contaminated tracked files"
            }
          ],
          "dependencies": [
            {
              "type": "tool",
              "name": "git",
              "version": "*"
            }
          ]
        },
        {
          "name": "sanitize",
          "version": 29,
          "changelog": [
            {
              "version": 29,
              "changes": "Update argument-hint to [path]"
            },
            {
              "version": 28,
              "changes": "Moved from p4-plugin to p4-core; scope extended to all sensitive-capable file types"
            },
            {
              "version": 28,
              "changes": "Extend scan scope to all sensitive-capable file types across the repo (docs, configs, scripts, structured data), not just plugin/skill files"
            },
            {
              "version": 27,
              "changes": "Initial release"
            }
          ]
        }
      ]
    },
    {
      "name": "p4-claudecode",
      "description": "Claude Code-exclusive enhancements: custom statusline with project path, git branch, active model with effort level and color-coded usage metrics.",
      "category": "productivity",
      "status": "stable",
      "version": "1.0.3",
      "spec": "specs/p4-claudecode.md",
      "path": "plugins/p4-claudecode",
      "changelog": [
        {
          "version": "1.0.3",